ID,CourseContentId,IdContent,QuestionType,QuestionContent,AAnsver,BAnswer,CAnswer,DAnswer,Answer,ResultAnswer,
1,Module 6. Ứng dụng trí tuệ nhân tạo,6,1,"Theo định nghĩa của Microsoft, Trí tuệ nhân tạo (AI) là nỗ lực để tạo ra gì?",Tạo ra rô bốt có khả năng di chuyển và tương tác vật lý.,"Tạo ra một máy tính, rô bốt hoặc công nghệ khác ""suy nghĩ"" và xử lý dữ liệu theo cách giống như con người chúng ta.",Tạo ra phần mềm có khả năng lập trình tự động.,Tạo ra một hệ thống tự động hóa hoàn toàn các quy trình sản xuất.,B,"Tạo ra một máy tính, rô bốt hoặc công nghệ khác ""suy nghĩ"" và xử lý dữ liệu theo cách giống như con người chúng ta.",
2,Module 6. Ứng dụng trí tuệ nhân tạo,6,1,Mục đích của Trí tuệ nhân tạo là gì?,"Từ 5 - 10 triệu, buộc gỡ bỏ thông tin vi phạm. Trong trường hợp gây ảnh hưởng đến danh dự, uy tín của người khác 10 - 15 triệu",Tự động hóa các tác vụ lặp đi lặp lại.,Cải thiện khả năng kết nối giữa các thiết bị.,"Cải thiện công nghệ bằng cách bổ sung chức năng liên quan đến hành vi và cách con người suy luận, học tập và giải quyết vấn đề.",D,"Cải thiện công nghệ bằng cách bổ sung chức năng liên quan đến hành vi và cách con người suy luận, học tập và giải quyết vấn đề.",
3,Module 6. Ứng dụng trí tuệ nhân tạo,6,1,"Trong các năng lực sau, năng lực nào được coi là cốt lõi mà một module AI phải đáp ứng?",Tạo ra một lượng lớn rác thải điện tử từ các thiết bị đào lỗi thời.,Không quan tâm đến quyền riêng tư và chia sẻ mọi thông tin cá nhân.,"Kích thích não bộ, làm cho người dùng cảm thấy tỉnh táo và khó ngủ hơn.","Suy diễn, học, giải quyết vấn đề, nhận thức và trí thông minh ngôn ngữ.",D,"Suy diễn, học, giải quyết vấn đề, nhận thức và trí thông minh ngôn ngữ.",
4,Module 6. Ứng dụng trí tuệ nhân tạo,6,1,"Trong bối cảnh chuyển đổi số, Trí tuệ nhân tạo (AI) thường được ví như bộ phận nào của con người?",OpenRefine,Xóa thông tin,Hệ thần kinh.,Hibernate Mode,C,Hệ thần kinh.,
5,Module 6. Ứng dụng trí tuệ nhân tạo,6,1,"Theo nghĩa hẹp, trí tuệ nhân tạo nhằm mục đích gì?",Im lặng và hy vọng mọi người sẽ quên đi.,Tăng cường năng lực trí tuệ của con người.,Xử lý dữ liệu lớn trên các máy chủ ảo.,Phân tích các mối quan hệ xã hội phức tạp.,B,"""Tăng cường năng lực trí tuệ của con người"".",
6,Module 6. Ứng dụng trí tuệ nhân tạo,6,1,"Khi một hệ thống AI tích hợp nhiều module AI, nó bao gồm hai yếu tố chính nào?",Mô tả chi tiết nội dung muốn sử dụng.,Chia sẻ mọi thông tin mà không cần kiểm chứng,Tác nhân và môi trường xung quanh của nó.,Nền tảng Cloud và mạng lưới cảm biến.,C,Tác nhân và môi trường xung quanh của nó.,
7,Module 6. Ứng dụng trí tuệ nhân tạo,6,1,Trí thông minh của các tác nhân AI được đo lường bằng khả năng nào của chúng?,Các bình luận tương tác của người dùng trên YouTube,Giúp nội dung trở nên phức tạp và học thuật hơn.,Khả năng tạo ra các mục tiêu và đạt được chúng.,Khả năng tương tác với các ứng dụng di động.,C,Khả năng tạo ra các mục tiêu và đạt được chúng.,
8,Module 6. Ứng dụng trí tuệ nhân tạo,6,1,"Trong bối cảnh AI, thuật toán học sâu dựa trên mô phỏng cấu trúc nào?",Quyền đăng tải mọi thông tin không cần kiểm chứng,Tuân thủ mệnh lệnh từ lãnh đạo một cách tuyệt đối,Mạng nơ-ron và hoạt động của bộ não con người.,Tăng tốc độ truyền tải và lưu trữ dữ liệu.,C,Mạng nơ-ron và hoạt động của bộ não con người.,
9,Module 6. Ứng dụng trí tuệ nhân tạo,6,1,"Thuật ngữ nào sau đây được xem là một nhánh của Trí tuệ nhân tạo, có mục tiêu làm cho máy móc có khả năng học tập như con người?",Lập trình hướng đối tượng.,Chuyên gia phân tích dữ liệu.,Máy học (Machine Learning).,Chuỗi khối (Blockchain).,C,Máy học (Machine Learning).,
10,Module 6. Ứng dụng trí tuệ nhân tạo,6,1,Trí tuệ nhân tạo giúp giải quyết vấn đề gì liên quan đến các cuộc họp tại công sở?,Nhấp vào liên kết để kiểm tra xem trang web có hợp pháp không.,Trả lời những câu hỏi nền tảng để tiết kiệm thời gian họp.,Nhân bản vô tính các loài động vật có nguy cơ tuyệt chủng.,Phần mềm có thể xử lý lượng lớn dữ liệu một cách tự động.,B,Trả lời những câu hỏi nền tảng để tiết kiệm thời gian họp.,
11,Module 6. Ứng dụng trí tuệ nhân tạo,6,1,"Trong lĩnh vực sản xuất, AI có thể giúp tối ưu hóa hoạt động bằng cách nào?",Khó khăn trong việc thay đổi thói quen của người dân.,Tăng cường sử dụng các công cụ phần mềm văn phòng.,Hỗ trợ bảo trì tiên đoán để tối ưu hóa kế hoạch bảo trì.,Thay thế toàn bộ hệ thống dây điện cũ bằng dây điện mới.,C,Hỗ trợ bảo trì tiên đoán để tối ưu hóa kế hoạch bảo trì.,
12,Module 6. Ứng dụng trí tuệ nhân tạo,6,1,Ba module AI phải đáp ứng được năng lực nào sau đây?,"Suy diễn, Phân tích, Lập trình.","Suy diễn, Học, Giải quyết vấn đề.","Trình bày, Thấu cảm, Sáng tạo.","Lập trình, Tính toán, Tích hợp.",B,"Suy diễn, Học, Giải quyết vấn đề.",
13,Module 6. Ứng dụng trí tuệ nhân tạo,6,1,Khả năng tạo ra các mục tiêu và đạt được chúng là thước đo cho điều gì trong hệ thống AI?,Phát tán thông tin chưa kiểm chứng,Khả năng tương tác với người dùng.,Đặt biểu đồ xa bảng dữ liệu gốc,Trí thông minh của các tác nhân AI.,D,Trí thông minh của các tác nhân AI.,
14,Module 6. Ứng dụng trí tuệ nhân tạo,6,1,Điều gì là nguồn gốc của sự phát triển đột phá trong Máy học (Machine Learning)?,Sử dụng tất cả các ứng dụng và thiết bị có sẵn một cách tối đa.,Cần hỏi ý kiến và nhận được đồng ý của các thành viên mới chia sẻ,Dữ liệu ngày càng nhiều và năng lực tính toán ngày càng mạnh.,Tất cả các thông tin được lưu trữ trên máy tính hoặc điện thoại.,C,Dữ liệu ngày càng nhiều và năng lực tính toán ngày càng mạnh.,
15,Module 6. Ứng dụng trí tuệ nhân tạo,6,1,"Trong một hệ thống AI, các module AI được tích hợp phải đáp ứng năng lực về Trí thông minh ngôn ngữ, điều này liên quan đến khả năng nào?",Dữ liệu không được lưu tự động,Khả năng viết mã lập trình phức tạp.,Khả năng nhận diện cảm xúc.,Khả năng xử lý ngôn ngữ tự nhiên.,D,Khả năng xử lý ngôn ngữ tự nhiên.,
16,Module 6. Ứng dụng trí tuệ nhân tạo,6,1,"Trong lĩnh vực điều trị và chăm sóc sức khỏe, AI hỗ trợ bác sĩ trong quy trình nào sau đây?",Che giấu những điểm yếu của quy trình,"Chẩn đoán, phát triển điều trị và thuốc.",Lập kế hoạch tài chính cho bệnh viện.,Xây dựng chính sách y tế công cộng.,B,"Chẩn đoán, phát triển điều trị và thuốc.",
17,Module 6. Ứng dụng trí tuệ nhân tạo,6,1,Công nghệ IoMT (Internet of Medical Things) giúp gì trong lĩnh vực y tế?,"Kỹ năng công nghệ, nhận thức kỹ thuật số, trách nhiệm công dân số.",Các thiết bị số có khả năng kết nối với nhau qua mạng internet.,Giúp mọi công dân dễ dàng tiếp cận các dịch vụ chăm sóc sức khỏe.,Cung cấp các bộ công cụ khai thác (exploit kits) cho Script Kiddies.,C,Giúp mọi công dân dễ dàng tiếp cận các dịch vụ chăm sóc sức khỏe.,
18,Module 6. Ứng dụng trí tuệ nhân tạo,6,1,"Trong lĩnh vực nông nghiệp, ứng dụng AI Sowing App powered dựa trên Microsoft Cortana Intelligence Suite giúp nông dân làm gì?",Tự động hóa hoàn toàn việc thu hoạch mùa màng.,Gửi lời khuyên về ngày tối ưu để gieo hạt.,Không có trích dẫn hay dữ liệu minh chứng,Xây dựng chiến lược marketing nông sản.,B,Gửi lời khuyên về ngày tối ưu để gieo hạt.,
19,Module 6. Ứng dụng trí tuệ nhân tạo,6,1,Rô bốt nông nghiệp ứng dụng AI thường được lập trình để thực hiện nhiệm vụ gì?,Thiết kế cảnh quan nông trại.,Thu hoạch mùa màng công suất lớn.,Phân tích xu hướng thị trường nông sản.,Quản lý chuỗi cung ứng toàn cầu.,B,Thu hoạch mùa màng công suất lớn.,
20,Module 6. Ứng dụng trí tuệ nhân tạo,6,1,"Trong quản lý đại lý bán lẻ, ứng dụng AI có thể tối ưu hóa hoạt động kinh doanh trong các lĩnh vực nào?",Góp phần xây dựng cộng đồng mạng an toàn và lành mạnh,Lập kế hoạch chuỗi cung ứng và dự báo nhu cầu khách hàng.,Xây dựng thương hiệu và quản lý khủng hoảng truyền thông.,Gây ra các cơn ác mộng và làm gián đoạn chu kỳ giấc ngủ.,B,Lập kế hoạch chuỗi cung ứng và dự báo nhu cầu khách hàng.,
21,Module 6. Ứng dụng trí tuệ nhân tạo,6,1,"Trong lĩnh vực bán lẻ, AI có thể giúp gia tăng doanh số bằng cách nào?",Thu thập càng nhiều dữ liệu càng tốt để phục vụ cho các mục đích trong tương lai.,Dự báo các hoạt động làm tăng doanh số bán hàng (ví dụ: phương thức trả sau).,Kẻ tấn công sử dụng lỗi chính tả trong mật khẩu để làm cho chúng khó đoán hơn.,Kẻ tấn công cài đặt phần mềm gián điệp để ghi lại mật khẩu khi người dùng gõ.,B,Dự báo các hoạt động làm tăng doanh số bán hàng (ví dụ: phương thức trả sau).,
22,Module 6. Ứng dụng trí tuệ nhân tạo,6,1,"Trong đời sống cá nhân, ứng dụng AI trên thiết bị thông minh có thể hỗ trợ nhiệm vụ gì?",Kẻ tấn công sử dụng một chìa khóa đa năng để bẻ khóa mã.,Theo dõi sức khỏe hàng ngày và nhắc nhở lịch công tác.,Sử dụng các công cụ tấn công đơn giản và dễ bị phát hiện.,Tốc độ mã hóa nhanh hơn và tốn ít tài nguyên hệ thống hơn.,B,Theo dõi sức khỏe hàng ngày và nhắc nhở lịch công tác.,
23,Module 6. Ứng dụng trí tuệ nhân tạo,6,1,Công nghệ nào là ví dụ về hệ thống thông minh được điều khiển bằng giọng nói và được tích hợp vào Windows 10?,Google Drive.,Siri.,Alexa.,Cortana.,D,Cortana.,
24,Module 6. Ứng dụng trí tuệ nhân tạo,6,1,Cortana được tích hợp vào Windows 10 cho phép thực hiện chức năng tự động nào?,Thuật toán được sử dụng để mã hóa dữ liệu.,Tìm kiếm tập tin trên thiết bị và mở ứng dụng.,Tự động sao lưu toàn bộ dữ liệu máy tính.,Sử dụng một cặp khóa công khai và khóa riêng tư.,B,Tìm kiếm tập tin trên thiết bị và mở ứng dụng.,
25,Module 6. Ứng dụng trí tuệ nhân tạo,6,1,"Natural Language Generation (NLG), một lĩnh vực con của AI, được ứng dụng điển hình trong việc gì?",Đánh cắp danh tính và tấn công bằng mã độc.,Phân tích tín hiệu điện toán đám mây.,Phân loại văn bản (ví dụ: thư rác - spam).,Kết hợp các phần nội dung khác nhau lại.,C,Phân loại văn bản (ví dụ: thư rác - spam).,
26,Module 6. Ứng dụng trí tuệ nhân tạo,6,1,Speech recognition (nhận dạng giọng nói) là công nghệ mà ở đó máy tính được sử dụng để làm gì?,"Xác thực (Authentication), Ủy quyền (Authorization), Ghi nhận (Accounting).",Nắm bắt các cuộc trò chuyện với con người và chuyển đổi thành các mệnh lệnh.,Một sai sót hoặc điểm yếu cho phép kẻ tấn công vượt qua hàng rào an ninh.,Việc nâng cao nhận thức về môi trường lại khiến người ta tiêu thụ nhiều hơn.,B,Nắm bắt các cuộc trò chuyện với con người và chuyển đổi thành các mệnh lệnh.,
27,Module 6. Ứng dụng trí tuệ nhân tạo,6,1,Ứng dụng Microsoft Connected Life có mục đích gì trong hệ thống tự động hóa nhà thông minh?,"Cho phép các thiết bị gia dụng (đèn, TV) được điều khiển từ bất kỳ thiết bị Windows nào.",Quản lý tài nguyên phần cứng và cung cấp môi trường cho các ứng dụng khác hoạt động.,Giảm dung lượng lưu trữ cần thiết cho các loại dữ liệu phức tạp như video và hình ảnh.,Kẻ tấn công tìm kiếm định nghĩa của các từ liên quan đến người dùng để đoán mật khẩu.,A,"Cho phép các thiết bị gia dụng (đèn, TV) được điều khiển từ bất kỳ thiết bị Windows nào.",
28,Module 6. Ứng dụng trí tuệ nhân tạo,6,1,AI trong lĩnh vực nông nghiệp ứng dụng Thị giác máy tính (Computer Vision) kết hợp Học sâu (Deep Learning) để theo dõi điều gì?,Đảm bảo thông tin là chính xác và không bị thay đổi.,Tình trạng phát triển của cây trồng và sâu bệnh.,Tăng cường sử dụng các công cụ phần mềm văn phòng.,Một loại giấy phép phải đăng ký để được bảo hộ.,B,Tình trạng phát triển của cây trồng và sâu bệnh.,
29,Module 6. Ứng dụng trí tuệ nhân tạo,6,1,Ứng dụng AI vào hệ thống nhà thông minh trong tương lai sẽ học thói quen cuộc sống cá nhân của người dùng để làm gì?,Tạo ra một chu trình sản xuất và tiêu dùng liên tục không có điểm dừng.,Cung cấp hướng dẫn sửa chữa chi tiết cho tất cả các loại thiết bị.,Thay thế người dùng để điều khiển các thiết bị phù hợp theo thói quen.,Quét hệ thống để tìm kiếm các lỗ hổng bảo mật và đề xuất các bản vá.,C,Thay thế người dùng để điều khiển các thiết bị phù hợp theo thói quen.,
30,Module 6. Ứng dụng trí tuệ nhân tạo,6,1,"Trong lĩnh vực nông nghiệp, mục tiêu của việc ứng dụng AI là gì?",Giảm sự phụ thuộc vào các nguồn tài nguyên tái tạo.,Cách thức lưu trữ cũng như định dạng văn bản hiển thị,Dự đoán năng suất trên đồng ruộng và phát hiện sâu bệnh.,Tiêu chuẩn hóa quy trình cấp giấy phép kinh doanh nông nghiệp.,C,Dự đoán năng suất trên đồng ruộng và phát hiện sâu bệnh.,
31,Module 6. Ứng dụng trí tuệ nhân tạo,6,2,Năng lực đầu tiên và cơ bản nhất mà bất kỳ ai sống và làm việc trong môi trường AI phải có là gì?,Lỗi Thời gian chạy (Runtime Errors),Năng lực nhận ra AI (AI Recognition).,Nén dữ liệu để giảm dung lượng lưu trữ.,Đưa ra quyết định dựa trên điều kiện.,B,Năng lực nhận ra AI (AI Recognition).,
32,Module 6. Ứng dụng trí tuệ nhân tạo,6,2,"""Khả năng thảo luận và phân tích những đặc điểm để tạo nên thực thể 'thông minh', bao gồm sự khác biệt giữa con người, động vật và máy thông minh"" thuộc năng lực nào?",Sinh viên có khả năng lập kế hoạch nội dung chi tiết.,Hiểu biết về sự thông minh (Understanding Intelligence).,Các tệp tin hình ảnh với đuôi mở rộng như JPEG hay PNG,Ẩn danh tính của người gửi để bảo vệ quyền riêng tư.,B,Hiểu biết về sự thông minh (Understanding Intelligence).,
33,Module 6. Ứng dụng trí tuệ nhân tạo,6,2,Năng lực Kiến thức liên ngành (Interdisciplinarity) đòi hỏi nhận ra điều gì?,Sự khác biệt giữa dữ liệu cấu trúc và phi cấu trúc.,Quản lý thời gian sử dụng thiết bị một cách hiệu quả.,"Có nhiều cách để suy nghĩ và phát triển máy ""thông minh"".",Chuỗi các tri thức chuyên sâu tập trung vào một lĩnh vực,C,"Có nhiều cách để suy nghĩ và phát triển máy ""thông minh"".",
34,Module 6. Ứng dụng trí tuệ nhân tạo,6,2,Công nghệ AI hẹp (Narrow AI) mô phỏng theo trí thông minh của con người trong phạm vi nào?,Nhiều lĩnh vực khác nhau.,Tầm cỡ toàn cầu.,Một lĩnh vực cụ thể.,"""lỗi wifi win 11""",C,Một lĩnh vực cụ thể.,
35,Module 6. Ứng dụng trí tuệ nhân tạo,6,2,Năng lực xác định được các ưu điểm và nhược điểm của công nghệ AI được gọi là gì?,Điểm mạnh và điểm yếu của AI.,Năng lực đánh giá rủi ro.,Dùng nhiều biểu tượng cảm xúc,Năng lực quản lý dự án.,A,Điểm mạnh và điểm yếu của AI.,
36,Module 6. Ứng dụng trí tuệ nhân tạo,6,2,"""Hình dung được các ứng dụng khả thi trong tương lai của AI và đánh giá được tác động của các ứng dụng đó đối với thế giới"" thuộc năng lực nào?",Năng lực giải quyết vấn đề số.,Để thiết kế các font chữ độc đáo.,Hình dung được tương lai của AI.,Năng lực quản lý danh tính số.,C,Hình dung được tương lai của AI.,
37,Module 6. Ứng dụng trí tuệ nhân tạo,6,2,Năng lực trình bày trong AI liên quan đến việc gì?,Cho phép nhiều người cùng chỉnh sửa trực tiếp mà không cần trao đổi,Các công ty công nghệ không có khả năng lưu trữ lượng lớn dữ liệu.,Biểu diễn tri thức và trình bày các sơ đồ/mô hình biểu diễn tri thức.,Trồng được các loại cây trồng mới không phù hợp với điều kiện địa phương.,C,Biểu diễn tri thức và trình bày các sơ đồ/mô hình biểu diễn tri thức.,
38,Module 6. Ứng dụng trí tuệ nhân tạo,6,2,Năng lực ra quyết định trong AI liên quan đến việc gì?,Tốc độ mã hóa và giải mã chậm hơn so với thuật toán bất đối xứng.,Nhận biết và mô tả về cách máy tính lập luận và đưa ra quyết định.,Kết nối các máy tính và thiết bị khác trong một mạng lưới cục bộ.,Tháo dỡ các thiết bị cũ để lấy các linh kiện còn sử dụng được.,B,Nhận biết và mô tả về cách máy tính lập luận và đưa ra quyết định.,
39,Module 6. Ứng dụng trí tuệ nhân tạo,6,2,Hiểu các bước liên quan đến học máy (Machine Learning) thuộc năng lực nào?,Tổ chức các cuộc thi khoa học cho sinh viên.,Năng lực hiểu biết về các bước học máy trong AI.,Năng lực phân tích dữ liệu thời gian thực.,Tạo ra các khu bảo tồn ảo để động vật sinh sống.,B,Năng lực hiểu biết về các bước học máy trong AI.,
40,Module 6. Ứng dụng trí tuệ nhân tạo,6,2,Vai trò của con người trong AI được thể hiện qua các khía cạnh nào?,Dữ liệu có thể truy cập được bởi người dùng được ủy quyền.,Các thành viên làm việc cùng nhau tại cùng một thời điểm,Máy tính cá nhân (PC) và máy tính xách tay (laptop).,"Lập trình, lựa chọn mô hình và tinh chỉnh hệ thống AI.",D,"Lập trình, lựa chọn mô hình và tinh chỉnh hệ thống AI.",
41,Module 6. Ứng dụng trí tuệ nhân tạo,6,2,Khái niệm cơ bản về kiến thức dữ liệu và vai trò của dữ liệu đối với các hệ thống AI thuộc năng lực nào?,Năng lực giao tiếp.,Kiến thức về dữ liệu.,Năng lực quản lý tri thức.,Năng lực suy diễn.,B,Kiến thức về dữ liệu.,
42,Module 6. Ứng dụng trí tuệ nhân tạo,6,2,Năng lực Học từ dữ liệu đòi hỏi nhận ra điều gì?,Sắp xếp dữ liệu theo thứ tự alphabet.,Các thuật toán luôn chính xác tuyệt đối.,Máy tính thường học hỏi từ dữ liệu.,Dữ liệu luôn cần phải được mã hóa.,C,Máy tính thường học hỏi từ dữ liệu.,
43,Module 6. Ứng dụng trí tuệ nhân tạo,6,2,Năng lực về việc học từ dữ liệu nhấn mạnh vào quy trình nào?,"Sử dụng tính năng ""Comment"" hoặc ""Suggesting"" để đề xuất sửa đổi và tag người liên quan",Quy trình học từ dữ liệu của các hệ thống AI để làm giàu thêm trí tuệ của máy tính.,"Mật mã học là một kỹ thuật cũ, trong khi steganography là một kỹ thuật hiện đại.",Kẻ tấn công tìm kiếm định nghĩa của các từ liên quan đến người dùng để đoán mật khẩu.,B,Quy trình học từ dữ liệu của các hệ thống AI để làm giàu thêm trí tuệ của máy tính.,
44,Module 6. Ứng dụng trí tuệ nhân tạo,6,2,Tại sao cần huấn luyện hệ thống AI trên tập dữ liệu sạch?,Khuyến khích người tiêu dùng liên tục mua các sản phẩm mới để thúc đẩy kinh tế.,Làm cho việc lưu trữ dữ liệu trở nên kém an toàn hơn do phải phụ thuộc vào bên thứ ba.,Vì chất lượng của tập dữ liệu ban đầu có thể ảnh hưởng đến kết quả của thuật toán.,Việc tái chế một sản phẩm lại tốn nhiều năng lượng hơn là sản xuất một sản phẩm mới.,C,Vì chất lượng của tập dữ liệu ban đầu có thể ảnh hưởng đến kết quả của thuật toán.,
45,Module 6. Ứng dụng trí tuệ nhân tạo,6,2,Năng lực Hành động & Phản ứng trong AI là gì?,Tải tất cả dữ liệu của mình lên đám mây để giải phóng dung lượng trên thiết bị cá nhân.,"Sử dụng tính năng ""Comment"" hoặc ""Suggesting"" để đề xuất sửa đổi và tag người liên quan",Hiểu rằng một số hệ thống AI có khả năng hành động theo những gì nó cảm nhận từ môi trường.,Thông tin đã được cố tình che giấu và không thể truy cập qua trình duyệt web tiêu chuẩn.,C,Hiểu rằng một số hệ thống AI có khả năng hành động theo những gì nó cảm nhận từ môi trường.,
46,Module 6. Ứng dụng trí tuệ nhân tạo,6,2,Hệ thống AI nhận biết thế giới bằng cách nào?,Trồng được các loại cây trồng mới không phù hợp với điều kiện địa phương.,Tranh luận công khai trên kênh chat chung cho đến khi có người thắng cuộc,Bằng cách sử dụng cảm biến để cảm nhận các tác nhân từ môi trường xung quanh.,Kẻ tấn công cài đặt phần mềm gián điệp để ghi lại mật khẩu khi người dùng gõ.,C,Bằng cách sử dụng cảm biến để cảm nhận các tác nhân từ môi trường xung quanh.,
47,Module 6. Ứng dụng trí tuệ nhân tạo,6,2,"Để làm việc trong lĩnh vực Phân tích dữ liệu lớn (BDA), kỹ năng chuyên môn nào sau đây là quan trọng?",Thêm nhiều bước không cần thiết vào quy trình,Chuyển tiếp email cho đồng nghiệp để hỏi ý kiến,Trực quan hóa dữ liệu (Data visualization).,Việc giao tiếp với bạn bè qua mạng xã hội,C,Trực quan hóa dữ liệu (Data visualization).,
48,Module 6. Ứng dụng trí tuệ nhân tạo,6,2,"Năng lực nào đòi hỏi hiểu được quy trình huấn luyện trên tập dữ liệu sạch, kiểm thử và tinh chỉnh mô hình?","Text, Resolution, Audio, Speed",Một bản cập nhật của hệ điều hành,Năng lực về Hành động & Phản ứng.,Năng lực suy diễn từ dữ liệu.,D,Năng lực suy diễn từ dữ liệu.,
49,Module 6. Ứng dụng trí tuệ nhân tạo,6,2,Năng lực nào của người lao động trong lĩnh vực BDA được xem là cực kỳ quan trọng do tính đa ngành của công việc?,Đề xuất các khóa học trực tuyến phù hợp.,Tin vào thông tin trái ngược niềm tin,Thay thế cho phần mềm diệt virus,Năng lực xã hội (kỹ năng con người).,D,Năng lực xã hội (kỹ năng con người).,
50,Module 6. Ứng dụng trí tuệ nhân tạo,6,2,Khung năng lực số DigCompEdu của châu Âu được thiết kế cho đối tượng nào?,Khả năng tạo ra nội dung đa phương tiện.,Tài liệu phải được viết cách đây rất lâu,Các nhà giáo dục ở tất cả các mức giáo dục.,Việc giao tiếp với bạn bè qua mạng xã hội,C,Các nhà giáo dục ở tất cả các mức giáo dục.,
