ID,CourseContentId,IdContent,QuestionType,QuestionContent,AAnsver,BAnswer,CAnswer,DAnswer,Answer,ResultAnswer,
105,Module 6. Ứng dụng trí tuệ nhân tạo,6,4,Chuyển đổi số trong lĩnh vực Tài chính - Ngân hàng thúc đẩy hợp tác với các công ty nào trong việc xây dựng hệ sinh thái dịch vụ?,Bắt buộc tất cả các trung tâm dữ liệu phải tự sản xuất năng lượng.,Có kỹ năng máy tính tiên tiến và tự viết các công cụ tấn công.,Công ty công nghệ tài chính (Fintech) và trung gian thanh toán.,Coi như họ đang không hợp tác và tự làm thay công việc của họ,C,Công ty công nghệ tài chính (Fintech) và trung gian thanh toán.,
106,Module 6. Ứng dụng trí tuệ nhân tạo,6,4,"Khả năng sử dụng các công cụ lập trình bậc cao như Java, Swift, và Node.js là cần thiết cho nhóm chuyên gia nào trong lĩnh vực IoT?",Tin vào thông tin trái ngược niềm tin,Đưa ra các cảnh báo về an ninh mạng.,Thiết kế và phát triển ứng dụng (UI/UX).,Để tối ưu hóa tốc độ xử lý của máy tính.,C,Thiết kế và phát triển ứng dụng (UI/UX).,
107,Module 6. Ứng dụng trí tuệ nhân tạo,6,4,Kỹ năng nào được coi là thiết yếu trong IoT để thiết kế và quản lý mạng?,Phân tích ngữ nghĩa.,Mạng máy tính (Network).,Yêu cầu kết nối mạng dây,Học tập tự điều chỉnh.,B,Mạng máy tính (Network).,
108,Module 6. Ứng dụng trí tuệ nhân tạo,6,4,"Đối với người phát triển hệ thống IoT, khả năng lập trình nhúng (embedded programming) cần thành thạo ngôn ngữ nào?",Thói quen số (Digital Habits),Chỉ các bình luận trên mạng xã hội,"C, C++, Python, hoặc JavaScript.",Chi phí đầu tư hạ tầng quá cao.,C,"C, C++, Python, hoặc JavaScript.",
109,Module 6. Ứng dụng trí tuệ nhân tạo,6,4,Tại sao vấn đề bảo mật IoT phải được cân nhắc ưu tiên?,Kẻ tấn công sửa lỗi chính tả trên các trang web để làm cho chúng trông hợp pháp hơn.,Vì các thiết bị IoT khá dễ bị xâm phạm bảo mật do tính đa dạng và đa nền tảng kết nối.,Ngăn chặn các email lừa đảo và thư rác trước khi chúng đến hộp thư của người dùng.,"Sử dụng tính năng ""Comment"" hoặc ""Suggesting"" để đề xuất sửa đổi và tag người liên quan",B,Vì các thiết bị IoT khá dễ bị xâm phạm bảo mật do tính đa dạng và đa nền tảng kết nối.,
110,Module 6. Ứng dụng trí tuệ nhân tạo,6,4,Nền tảng học tập nào được đề cập là phù hợp cho việc học các khóa học về Machine Learning và Deep Learning?,Giảm xung đột cá nhân,"Udemy, Khan Academy.","Codecademy, The Code Player.",Tất cả các nền tảng trên.,D,Tất cả các nền tảng trên.,
111,Module 6. Ứng dụng trí tuệ nhân tạo,6,4,Năng lực nào liên quan đến việc xử lý một vấn đề tính toán thành các bước tuần tự và logic như một giải pháp cho hệ thống máy tính?,"Đưa ra phản hồi mang tính xây dựng, cụ thể",Tư duy tính toán (Computational thinking).,Vì Video A có chất lượng hình ảnh tốt hơn,Tuyển dụng nhân sự và quản lý tiền lương.,B,Tư duy tính toán (Computational thinking).,
112,Module 6. Ứng dụng trí tuệ nhân tạo,6,4,Tư duy tính toán (Computational thinking) được xem là khác biệt với lập trình ở điểm nào?,"Nó tập trung vào tư duy thuật toán như một phần của giải quyết vấn đề, không nhất thiết phải lập trình bằng ngôn ngữ cụ thể.","Từ 5 - 10 triệu, buộc gỡ bỏ thông tin vi phạm. Trong trường hợp gây ảnh hưởng đến danh dự, uy tín của người khác 10 - 15 triệu",Nó không yêu cầu kiến thức toán học.,Nó chỉ cần thiết cho các chuyên gia công nghệ.,A,"Nó tập trung vào tư duy thuật toán như một phần của giải quyết vấn đề, không nhất thiết phải lập trình bằng ngôn ngữ cụ thể.",
113,Module 6. Ứng dụng trí tuệ nhân tạo,6,4,Phẩm chất nào sau đây là cần thiết cho Tư duy đổi mới sáng tạo (Innovation)?,Lỗi Logic (Logical Errors),Thấu cảm và Giải quyết vấn đề.,Chỉ các bình luận trên mạng xã hội,Thông tin đúng nhưng gây hiểu nhầm,B,Thấu cảm và Giải quyết vấn đề.,
114,Module 6. Ứng dụng trí tuệ nhân tạo,6,4,"Theo các chuyên gia, các công ty nên xem xét trau dồi năng lực số tại nơi làm việc để nhân viên có thể thích ứng thành công với điều gì?",Thời gian sản xuất nội dung kéo dài.,"Các công cụ, hệ thống và quy trình mới.",Giám sát và góp ý một cách có trách nhiệm,Khả năng tạo ra nội dung đa phương tiện.,B,"Các công cụ, hệ thống và quy trình mới.",
115,Module 6. Ứng dụng trí tuệ nhân tạo,6,4,"Năng lực nào cho phép cá nhân điều chỉnh, hòa nhập, thích nghi nhanh chóng với sự thay đổi hoặc điều kiện mới?",Tính linh hoạt.,Tư duy phản biện.,Khả năng thích ứng.,Ghi rõ loại giấy phép.,C,Khả năng thích ứng.,
116,Module 6. Ứng dụng trí tuệ nhân tạo,6,4,"Trong lĩnh vực BDA, năng lực nào đòi hỏi phải hiểu và có khả năng phân tích và đánh giá dữ liệu, thông tin và nội dung số đặc thù trong hoạt động nghề nghiệp?",Bán kiến thức về các lỗ hổng bảo mật cho người trả giá cao nhất.,Tham gia vào các nhóm để công kích những người có ý kiến trái chiều.,Nhận biết và đánh giá nội dung và dữ liệu đặc thù cho công việc.,Cung cấp dịch vụ và tài nguyên cho các máy tính khác trong mạng.,C,Nhận biết và đánh giá nội dung và dữ liệu đặc thù cho công việc.,
117,Module 6. Ứng dụng trí tuệ nhân tạo,6,4,Yếu tố nào sau đây là nguyên nhân trực tiếp khiến Kodak phá sản vào năm 2012?,Ảnh hưởng đến danh tiếng và uy tín cá nhân trong đời thực,Sự xuất hiện của iPhone năm 2007 và Instagram năm 2010.,Sự cạnh tranh từ các công ty sản xuất phim ảnh truyền thống.,Sử dụng cùng một mật khẩu mạnh cho nhiều tài khoản.,B,Sự xuất hiện của iPhone năm 2007 và Instagram năm 2010.,
118,Module 6. Ứng dụng trí tuệ nhân tạo,6,4,"Trong quá trình xây dựng chính phủ số, rủi ro lớn nhất đối với quốc gia là gì?",Gây ra các cuộc xung đột về tài nguyên khoáng sản.,"Mất chủ quyền số quốc gia (an toàn, an ninh mạng).",Khó khăn trong việc thay đổi thói quen của người dân.,Phổ biến các hình thức xử phạt khi vi phạm bản quyền.,B,"Mất chủ quyền số quốc gia (an toàn, an ninh mạng).",
119,Module 6. Ứng dụng trí tuệ nhân tạo,6,4,"Theo quan điểm của DigCompEdu, ở mức Người tiên phong (Pioneer - C2), nhà giáo dục thường làm gì?","Kỹ năng công nghệ, nhận thức kỹ thuật số, trách nhiệm công dân số.",Phục hồi hệ thống nhanh nhất có thể sau khi một cuộc tấn công xảy ra.,Phát triển các tiếp cận sư phạm mới lạ và đổi mới sáng tạo giáo dục.,"Không có sự khác biệt, hai thuật ngữ này có thể dùng thay thế cho nhau.",C,Phát triển các tiếp cận sư phạm mới lạ và đổi mới sáng tạo giáo dục.,
120,Module 6. Ứng dụng trí tuệ nhân tạo,6,4,"Nền tảng công nghệ số nào sau đây được đề cập là giải pháp đột phá để thúc đẩy chuyển đổi số nhanh hơn, giảm chi phí và tăng hiệu quả?",Hệ thống thông tin ERP.,Nền tảng số (Platform).,Phần mềm diệt virus.,Thiết bị ngoại vi.,B,Nền tảng số (Platform).,
