ID,CourseContentId,IdContent,QuestionType,QuestionContent,AAnsver,BAnswer,CAnswer,DAnswer,Answer,ResultAnswer,
51,Module 6. Ứng dụng trí tuệ nhân tạo,6,2,"Để trở thành chuyên gia AI, kiến thức chuyên môn về Toán học nào là cần thiết?",Kết hợp nhiều đoạn nội dung lại với nhau,"Đại số, xác suất, thống kê và đồ thị.",Thông tin đúng được chia sẻ sai thời điểm,Chỉ đọc mà không bao giờ tương tác,B,"Đại số, xác suất, thống kê và đồ thị.",
52,Module 6. Ứng dụng trí tuệ nhân tạo,6,2,Kỹ năng chuyên sâu nào sau đây là yêu cầu cho chuyên gia AI?,Chỉ tập trung vào việc mã hóa tất cả dữ liệu để ngăn chặn truy cập trái phép.,"Lọc thay đổi thứ tự các dòng, còn Sắp xếp chỉ hiển thị dữ liệu thỏa điều kiện",Thành thạo các thuật toán Học máy (Machine Learning) và Học sâu (Deep Learning).,Cảnh cáo và gửi thông báo yêu cầu kỷ luật về địa phương hoặc cơ quan chủ quản,C,Thành thạo các thuật toán Học máy (Machine Learning) và Học sâu (Deep Learning).,
53,Module 6. Ứng dụng trí tuệ nhân tạo,6,2,Công nghệ lõi nào được VAIS sử dụng để chuyển giọng nói tiếng Việt thành văn bản?,Text To Speech.,Speech To Text.,Filter by condition,Gửi email hàng loạt,B,Speech To Text.,
54,Module 6. Ứng dụng trí tuệ nhân tạo,6,2,VBEE là nền tảng công nghệ lõi gì đối với tiếng Việt?,Giả danh một nhân vật có quyền uy để ra lệnh cho nạn nhân.,Chuyển văn bản thành giọng nói trí tuệ nhân tạo có cảm xúc.,Mua bán dữ liệu cá nhân bị đánh cắp trên các diễn đàn ngầm.,Thay thế toàn bộ hệ thống dây điện cũ bằng dây điện mới.,B,Chuyển văn bản thành giọng nói trí tuệ nhân tạo có cảm xúc.,
55,Module 6. Ứng dụng trí tuệ nhân tạo,6,2,Google Cloud Platform cung cấp dịch vụ nào hỗ trợ phát triển ứng dụng AI?,"Do router quá nóng, cần tắt đi",Study – Integrate – Filter – Track,Cloud Machine Learning Engine.,Theo dõi nguồn gốc sản phẩm.,C,Cloud Machine Learning Engine.,
56,Module 6. Ứng dụng trí tuệ nhân tạo,6,2,"Trong kiến trúc phân tích dữ liệu thời gian thực (Realtime Data Analytics), lớp nào bao gồm các ứng dụng của người dùng cuối?",Tốc độ phản hồi nhanh chóng,Lớp Phân tích (Analytics).,Lớp Tích hợp (Integration).,Lớp Quyết định (Decisions).,D,Lớp Quyết định (Decisions).,
57,Module 6. Ứng dụng trí tuệ nhân tạo,6,2,Các công cụ phân tích dữ liệu phổ biến bao gồm những công cụ nào sau đây?,Mỗi khi bạn muốn sử dụng tác phẩm của người khác.,"R Programming, Apache Hadoop, Apache Storm, MongoDB.",Sẵn sàng trả tiền để bảo vệ quyền riêng tư của mình.,Phản hồi chính sách thông qua cổng thông tin điện tử,B,"R Programming, Apache Hadoop, Apache Storm, MongoDB.",
58,Module 6. Ứng dụng trí tuệ nhân tạo,6,2,"Trong phân tích dữ liệu lớn (Big Data Analytics), người lao động cần kỹ năng gì liên quan đến kinh doanh?",Kẻ tấn công sử dụng một chìa khóa đa năng để bẻ khóa mã.,Am hiểu lĩnh vực kinh doanh và các công cụ Big Data.,Không can thiệp vào các cuộc trò chuyện song song,Tạo ra rô bốt có khả năng di chuyển và tương tác vật lý.,B,Am hiểu lĩnh vực kinh doanh và các công cụ Big Data.,
59,Module 6. Ứng dụng trí tuệ nhân tạo,6,2,Phân tích dữ liệu thời gian thực là ứng dụng các kỹ thuật nào để phát hiện các mẫu và tri thức từ dữ liệu theo thời gian thực?,Các kim loại có tính chất hóa học đối kháng nhau và không thể được sử dụng cùng lúc trong một thiết bị.,"Khai phá dữ liệu (Data Mining), Máy học (Machine Learning) và Trí tuệ nhân tạo (Artificial Intelligence).","Misinformation được lan truyền qua email, trong khi Disinformation được lan truyền qua mạng xã hội.","Misinformation là thông tin sai về khoa học, trong khi Disinformation là thông tin sai về chính trị.",B,"Khai phá dữ liệu (Data Mining), Máy học (Machine Learning) và Trí tuệ nhân tạo (Artificial Intelligence).",
60,Module 6. Ứng dụng trí tuệ nhân tạo,6,3,"Trong lĩnh vực tài chính thông minh, ứng dụng AI có thể giúp phát hiện các mối đe dọa nào?",Tự động hóa hoàn toàn việc thu hoạch mùa màng.,Quyền không cần cung cấp thông tin trung thực,Gian lận và hoạt động giao dịch bất hợp pháp.,Giám sát và góp ý một cách có trách nhiệm,C,Gian lận và hoạt động giao dịch bất hợp pháp.,
61,Module 6. Ứng dụng trí tuệ nhân tạo,6,3,Các thư viện (libraries) nào sau đây được sử dụng phổ biến trong lập trình AI/Machine Learning?,"Laravel, Django, Ruby on Rails.","Bootstrap, JQuery, Vue.js.","AutoCAD, SAP, Salesforce.","NumPy, Pandas, Scikit-Learn.",D,"NumPy, Pandas, Scikit-Learn.",
62,Module 6. Ứng dụng trí tuệ nhân tạo,6,3,"Yếu tố nào sau đây được xem là ""chất keo"" kết hợp các ứng dụng người dùng cuối và công cụ phân tích trong kiến trúc Realtime Data Analytics?",Tốc độ thực thi nhanh nhất.,Tăng chi phí sản xuất nội dung,Lớp Tích hợp (Integration).,"Codecademy, The Code Player.",C,Lớp Tích hợp (Integration).,
63,Module 6. Ứng dụng trí tuệ nhân tạo,6,3,"Trong lĩnh vực kiểm soát đám đông, AI được sử dụng để làm gì?",Kể cho họ nghe những câu chuyện tương tự để họ cảm thấy tốt hơn.,Dự đoán chuyển động của đám đông và đưa ra quyết định ngay lập tức.,"Sản phẩm (Products), Con người (People), Chính sách (Policies).",Quyền thay đổi dữ liệu của người khác mà không cần sự cho phép.,B,Dự đoán chuyển động của đám đông và đưa ra quyết định ngay lập tức.,
64,Module 6. Ứng dụng trí tuệ nhân tạo,6,3,Lĩnh vực nào sau đây được xem là một trong những ứng dụng quan trọng nhất của phân tích dữ liệu lớn theo thời gian thực?,Thương mại điện tử.,Khả năng bảo mật hệ thống.,Giao thông thông minh.,Nông nghiệp hữu cơ.,C,Giao thông thông minh.,
65,Module 6. Ứng dụng trí tuệ nhân tạo,6,3,"Theo các chuyên gia, năng lực nào sau đây nên được thêm vào Khung Năng lực Số toàn cầu (DLGF) do tính quan trọng ngày càng tăng?",Không có trích dẫn hay dữ liệu minh chứng,Tư duy tính toán (Computational thinking).,Chỉnh sửa tác phẩm gốc để nó trở nên khác đi.,Chỉ từ thông tin người dùng tự khai báo,B,Tư duy tính toán (Computational thinking).,
66,Module 6. Ứng dụng trí tuệ nhân tạo,6,3,Tư duy tính toán (Computational thinking) được đề xuất đặt dưới lĩnh vực năng lực nào trong DLGF?,Mô tả chi tiết nội dung muốn sử dụng.,Khi bạn không tìm thấy tên tác giả.,Giải quyết vấn đề (Problem solving).,Hệ thống miễn dịch (An ninh mạng).,C,Giải quyết vấn đề (Problem solving).,
67,Module 6. Ứng dụng trí tuệ nhân tạo,6,3,Chuyên gia AI cần có kiến thức chuyên sâu về ngôn ngữ lập trình nào?,"HTML, CSS, JavaScript.","Java, Python, R, C++.","SQL, XML, JSON.","Pascal, Delphi, VB.",B,"Java, Python, R, C++.",
68,Module 6. Ứng dụng trí tuệ nhân tạo,6,3,"Trong kiến trúc Realtime Data Analytics, các công cụ phân tích phổ biến nằm ở lớp nào?",Vận hành thiết bị ngoại vi.,Lớp Phân tích (Analytics).,Flickr (với bộ lọc giấy phép),Sử dụng phần mềm trình chiếu.,B,Lớp Phân tích (Analytics).,
69,Module 6. Ứng dụng trí tuệ nhân tạo,6,3,Công nghệ AI đã làm giảm đáng kể vai trò của trung gian trong các giao dịch nhờ vào công nghệ nào?,Internet vạn vật (IoT).,Chuỗi khối (Blockchain).,Điện toán đám mây.,Phân tích dữ liệu lớn.,B,Chuỗi khối (Blockchain).,
70,Module 6. Ứng dụng trí tuệ nhân tạo,6,3,Các chương trình AI nhúng trong các thiết bị và trong ứng dụng IoT làm tăng đáng kể điều gì của hệ thống?,Mức độ tuân thủ pháp luật.,Tốc độ kết nối mạng.,Sức mạnh của hệ thống.,Các cuộc họp mặt trực tiếp,C,Sức mạnh của hệ thống.,
71,Module 6. Ứng dụng trí tuệ nhân tạo,6,3,Năng lực nào đòi hỏi khả năng lập kế hoạch và phát triển một chuỗi lệnh dễ hiểu cho hệ thống máy tính để giải quyết một vấn đề nhất định?,Sáng thông tin và phương tiện.,Lập trình (Programming).,Tạo lập nội dung số.,Giải quyết vấn đề kỹ thuật.,B,Lập trình (Programming).,
72,Module 6. Ứng dụng trí tuệ nhân tạo,6,3,Năng lực Tạo lập nội dung số bao gồm việc dạy người học cách áp dụng gì cho nội dung số?,Blog cá nhân không rõ tác giả,Công nghệ thực tế ảo tăng cường.,Bản quyền và các giấy phép.,Phân tích dữ liệu lớn.,C,Bản quyền và các giấy phép.,
73,Module 6. Ứng dụng trí tuệ nhân tạo,6,3,"Trong lĩnh vực Sáng tạo nội dung số, năng lực nào liên quan đến việc sửa đổi, tinh chỉnh, nâng cấp và kết hợp thông tin/nội dung số vào vốn tri thức sẵn có?","Sản phẩm (Products), Con người (People), Chính sách (Policies).",Kết hợp và tái tạo nội dung số (Integrating and re-elaborating).,Tất cả các thông tin được lưu trữ trên máy tính hoặc điện thoại.,Sử dụng nhiều biểu tượng cảm xúc (emoji) để thể hiện thái độ.,B,Kết hợp và tái tạo nội dung số (Integrating and re-elaborating).,
74,Module 6. Ứng dụng trí tuệ nhân tạo,6,3,Năng lực nào đòi hỏi khả năng thiết kế và phát triển một chuỗi lệnh dễ hiểu cho hệ thống máy tính để giải quyết một nhiệm vụ cụ thể?,Tự động hóa.,Lập trình.,Cấu hình.,Lý trí,B,Lập trình.,
75,Module 6. Ứng dụng trí tuệ nhân tạo,6,3,"Trong mô hình khung năng lực số dành cho sinh viên, năng lực nào yêu cầu phát triển tư duy sáng tạo và quy trình tư duy thiết kế ý tưởng trong môi trường số?",Thực hành tư duy đổi mới sáng tạo trong xây dựng nội dung số.,Cần hỏi ý kiến và nhận được đồng ý của các thành viên mới chia sẻ,Có thể sử dụng vì mọi thứ trên internet vì chúng đều miễn phí,Tạo ra một hệ thống tự động hóa hoàn toàn các quy trình sản xuất.,A,Thực hành tư duy đổi mới sáng tạo trong xây dựng nội dung số.,
76,Module 6. Ứng dụng trí tuệ nhân tạo,6,3,Việc tạo lập và sửa đổi các sản phẩm số ở các định dạng khác nhau thuộc nhóm năng lực nào?,An toàn và an sinh số.,Sáng tạo nội dung số.,Chỉ để trò chuyện xã hội,Giao tiếp và hợp tác.,B,Sáng tạo nội dung số.,
77,Module 6. Ứng dụng trí tuệ nhân tạo,6,3,Năng lực Phát triển nội dung số yêu cầu người học có kiến thức cơ bản về chỉnh sửa và mã hóa của loại hình nào?,Giả danh một nhân vật có quyền uy để ra lệnh cho nạn nhân.,"Âm thanh, hình ảnh và video, ứng dụng và giao diện, trang web.",Kẻ tấn công thử mọi tổ hợp ký tự có thể có để tìm ra mật khẩu.,Được nhà nước bảo trợ để thực hiện các cuộc tấn công mạng.,B,"Âm thanh, hình ảnh và video, ứng dụng và giao diện, trang web.",
78,Module 6. Ứng dụng trí tuệ nhân tạo,6,3,Phẩm chất nào sau đây được liệt kê là cần thiết cho năng lực Tạo lập nội dung số?,Các quy trình truyền thống.,Sáng tạo và Tư duy đổi mới.,Thể hiện sự chuyên nghiệp,Kênh YouTube chuyên môn,B,Sáng tạo và Tư duy đổi mới.,
79,Module 6. Ứng dụng trí tuệ nhân tạo,6,3,Năng lực Lập trình trong Khung DigComp 2.0 (và DLGF) tập trung vào khía cạnh nào?,Lập kế hoạch và phát triển một chuỗi lệnh cho hệ thống tính toán.,Hướng dẫn quy trình rà soát và đánh giá tài nguyên nội dung đã có.,Coi như họ đang không hợp tác và tự làm thay công việc của họ,Sử dụng tất cả các ứng dụng và thiết bị có sẵn một cách tối đa.,A,Lập kế hoạch và phát triển một chuỗi lệnh cho hệ thống tính toán.,
80,Module 6. Ứng dụng trí tuệ nhân tạo,6,3,"Để giải quyết vấn đề kỹ thuật khi vận hành thiết bị, sinh viên cần có phẩm chất nào?",Bài viết vẫn rời rạc và không đúng hạn,Nhanh nhẹn và Linh hoạt trong nhận thức.,Tấn công vào các hệ thống tài chính cá nhân.,Nội dung đó đã có quá nhiều người sử dụng,B,Nhanh nhẹn và Linh hoạt trong nhận thức.,
81,Module 6. Ứng dụng trí tuệ nhân tạo,6,3,"Năng lực nào liên quan đến việc xác định, đánh giá, lựa chọn và sử dụng các công cụ và công nghệ số thích hợp để giải quyết vấn đề?",Tăng cường khả năng lưu trữ dữ liệu trên các thiết bị cá nhân như điện thoại và máy tính.,Quản lý tài nguyên phần cứng và cung cấp môi trường cho các ứng dụng khác hoạt động.,Nhận diện nhu cầu và đáp ứng công nghệ (Identifying needs and technological responses).,Thông tin đã được cố tình che giấu và không thể truy cập qua trình duyệt web tiêu chuẩn.,C,Nhận diện nhu cầu và đáp ứng công nghệ (Identifying needs and technological responses).,
82,Module 6. Ứng dụng trí tuệ nhân tạo,6,3,Năng lực Phát triển nội dung số đòi hỏi người học phải thể hiện bản thân qua đâu?,Sai sót trong mã lập trình hoặc cài đặt,Qua các phương tiện số (digital means).,Tin vào thông tin trái ngược niềm tin,Giảm chi phí sản xuất thiết bị y tế.,B,Qua các phương tiện số (digital means).,
83,Module 6. Ứng dụng trí tuệ nhân tạo,6,3,"Trong lĩnh vực Sản xuất kỹ thuật số (Digital Production), năng lực nào đòi hỏi sự sẵn sàng cập nhật những phát triển công nghệ và khám phá các cơ hội kỹ thuật số mới?",Khám phá kỹ thuật số (Digital exploration).,Khóa riêng tư (private key) của người gửi.,Giảm thời gian lập kế hoạch cho nội dung mới.,Quy trình xây dựng thương hiệu cá nhân.,A,Khám phá kỹ thuật số (Digital exploration).,
84,Module 6. Ứng dụng trí tuệ nhân tạo,6,3,"Trong lĩnh vực Sản xuất kỹ thuật số, năng lực Tự động hóa là gì?","Từ 5 - 10 triệu, buộc gỡ bỏ thông tin vi phạm. Trong trường hợp gây ảnh hưởng đến danh dự, uy tín của người khác 10 - 15 triệu",Khả năng tự động cập nhật hệ điều hành.,Khả năng sửa đổi hoặc tạo ra các giải pháp kỹ thuật số có thể tự động hóa hoàn toàn hoặc một phần để thực hiện một tác vụ.,Khả năng tự động quản lý danh tính số.,C,Khả năng sửa đổi hoặc tạo ra các giải pháp kỹ thuật số có thể tự động hóa hoàn toàn hoặc một phần để thực hiện một tác vụ.,
85,Module 6. Ứng dụng trí tuệ nhân tạo,6,3,Khung năng lực số DigCompEdu nhấn mạnh vai trò của nhà giáo dục là gì khi nói về công nghệ số?,Gây ô nhiễm nguồn nước do sử dụng hóa chất trong quá trình khai thác.,Người hướng dẫn và cố vấn cho người học trong các nỗ lực học tập tự chủ.,Mã hóa toàn bộ dữ liệu trên ổ cứng để bảo vệ khỏi truy cập trái phép.,Trồng được các loại cây trồng mới không phù hợp với điều kiện địa phương.,B,Người hướng dẫn và cố vấn cho người học trong các nỗ lực học tập tự chủ.,
86,Module 6. Ứng dụng trí tuệ nhân tạo,6,3,"Trong mô hình tiến triển DigCompEdu, giai đoạn nào được gọi là Chuyên gia (Expert - B2)?","Sắp xếp ẩn đi các dòng không phù hợp, còn Lọc thì không",Tiêu chuẩn hóa quy trình cấp giấy phép kinh doanh nông nghiệp.,"Giai đoạn áp dụng, mở rộng và suy ngẫm về các thực hành số.",Vứt bỏ các thiết bị cũ vào thùng rác tái chế thông thường.,C,"Giai đoạn áp dụng, mở rộng và suy ngẫm về các thực hành số.",
87,Module 6. Ứng dụng trí tuệ nhân tạo,6,3,Yêu cầu nào sau đây thuộc nhóm năng lực Phát triển nội dung số?,Bỏ qua quy trình cũ và làm theo cách hoàn toàn mới,Tín hiệu giữa chìa khóa và xe ô tô không được mã hóa.,Tạo lập và sửa nội dung số ở các định dạng khác nhau.,Thiếu các chương trình thu gom và tái chế hiệu quả.,C,Tạo lập và sửa nội dung số ở các định dạng khác nhau.,
88,Module 6. Ứng dụng trí tuệ nhân tạo,6,3,"Năng lực nào liên quan đến việc sử dụng các công cụ như Excel, MySQL hoặc Microsoft Access để thu thập và lưu trữ dữ liệu tự động?",Khai thác thông tin và dữ liệu.,Tự động hóa (Automation).,Sử dụng quá ít màu sắc,Cấp phép hoạt động sự kiện.,B,Tự động hóa (Automation).,
89,Module 6. Ứng dụng trí tuệ nhân tạo,6,3,"Trong năng lực Sáng tạo nội dung số, cần dạy người học cách làm gì với nội dung số?",Kẻ tấn công sửa lỗi chính tả trên các trang web để làm cho chúng trông hợp pháp hơn.,Giảm dung lượng lưu trữ cần thiết cho các loại dữ liệu phức tạp như video và hình ảnh.,"Áp dụng bản quyền và các giấy phép, cách tham chiếu các nguồn và ghi công các giấy phép.",Tải tất cả dữ liệu của mình lên đám mây để giải phóng dung lượng trên thiết bị cá nhân.,C,"Áp dụng bản quyền và các giấy phép, cách tham chiếu các nguồn và ghi công các giấy phép.",
90,Module 6. Ứng dụng trí tuệ nhân tạo,6,4,"Khả năng điều chỉnh các ứng dụng và thiết bị theo sở thích cá nhân hoặc nhu cầu của riêng họ, cũng như giải quyết các vấn đề kỹ thuật thuộc năng lực nào?",Tăng số lượng cuộc họp,"Time, Region, Author, Style",Cấu hình (Configuration).,Các ý tưởng chưa được công bố,C,Cấu hình (Configuration).,
91,Module 6. Ứng dụng trí tuệ nhân tạo,6,4,Cuộc Cách mạng Công nghiệp lần thứ tư khác biệt căn bản so với ba cuộc cách mạng trước ở điểm nào?,"Có, mọi thứ miễn phí xem đều có thể sử dụng.","Là thông minh hóa, máy móc thay lao động trí óc.",Tự động hóa hoàn toàn các quy trình kinh doanh.,Gây ra các cuộc xung đột về tài nguyên khoáng sản.,B,"Là thông minh hóa, máy móc thay lao động trí óc.",
92,Module 6. Ứng dụng trí tuệ nhân tạo,6,4,"Trong bối cảnh CMCN 4.0, công nghệ số có đặc điểm nào khiến nó khác biệt so với các cuộc cách mạng trước?",Chỉ khi tác phẩm đó được bán và tạo ra lợi nhuận,"Càng dùng nhiều, càng nhiều người dùng thì càng rẻ.",Cung cấp dịch vụ truyền hình trả phí qua Internet.,Phản hồi chính sách thông qua cổng thông tin điện tử,B,"Càng dùng nhiều, càng nhiều người dùng thì càng rẻ.",
93,Module 6. Ứng dụng trí tuệ nhân tạo,6,4,Yếu tố nào đóng vai trò quan trọng hơn trong CMCN 4.0 so với các cuộc cách mạng công nghiệp trước đây?,Tác phẩm được cung cấp miễn phí nhưng phải ghi nguồn.,Người dùng (quyết định sự thông minh của hệ thống).,Sinh viên có khả năng lập kế hoạch nội dung chi tiết.,"Sắp xếp ẩn đi các dòng không phù hợp, còn Lọc thì không",B,Người dùng (quyết định sự thông minh của hệ thống).,
94,Module 6. Ứng dụng trí tuệ nhân tạo,6,4,"Theo quan điểm của các tài liệu, chuyển đổi số là cuộc cách mạng về vấn đề gì nhiều hơn là công nghệ?","Thể chế, tư duy và nhận thức.",Viết code càng nhanh càng tốt.,Có nhiều lượt chia sẻ trên mạng,Marketing và thương hiệu.,A,"Thể chế, tư duy và nhận thức.",
95,Module 6. Ứng dụng trí tuệ nhân tạo,6,4,"Trong bối cảnh chuyển đổi số, dữ liệu lớn (Big Data) được ví như bộ phận nào của con người?",Bộ não.,Cơ bắp.,Hệ thần kinh.,Giác quan.,A,Bộ não.,
96,Module 6. Ứng dụng trí tuệ nhân tạo,6,4,Điện toán đám mây (Cloud Computing) được ví như bộ phận nào của con người?,Giác quan.,Hệ thần kinh.,Bộ não.,Cơ bắp.,D,Cơ bắp.,
97,Module 6. Ứng dụng trí tuệ nhân tạo,6,4,"Chính phủ số được định nghĩa là chính phủ điện tử, bổ sung thêm ""bốn Có"" nào?","Có hạ tầng, có ứng dụng, có nhân lực, có chính sách.","Có kinh tế số, có xã hội số, có công nghệ, có dữ liệu.","Có toàn bộ hoạt động an toàn trên môi trường số, có khả năng cung cấp dịch vụ mới nhanh chóng, có khả năng sử dụng nguồn lực tối ưu và có khả năng kiến tạo phát triển.","Có minh bạch, có hiệu quả, có tham nhũng thấp, có dịch vụ công.",C,"Có toàn bộ hoạt động an toàn trên môi trường số, có khả năng cung cấp dịch vụ mới nhanh chóng, có khả năng sử dụng nguồn lực tối ưu và có khả năng kiến tạo phát triển.",
98,Module 6. Ứng dụng trí tuệ nhân tạo,6,4,Yếu tố nào là điều kiện tiên quyết để chuyển đổi số thành công tại một tổ chức?,Coi như họ đang không hợp tác và tự làm thay công việc của họ,Các công ty công nghệ không có khả năng lưu trữ lượng lớn dữ liệu.,Quyết tâm và sự vào cuộc thực sự của người đứng đầu (Lãnh đạo).,Spear phishing chỉ nhắm vào các giám đốc điều hành cấp cao.,C,Quyết tâm và sự vào cuộc thực sự của người đứng đầu (Lãnh đạo).,
99,Module 6. Ứng dụng trí tuệ nhân tạo,6,4,Chuyển đổi số trong y tế hướng đến việc sử dụng loại hồ sơ nào để tiến tới không dùng bệnh án giấy?,Hồ sơ sức khỏe cá nhân.,Hồ sơ thanh toán viện phí.,Hồ sơ bệnh án điện tử.,Hồ sơ bảo hiểm y tế.,C,Hồ sơ bệnh án điện tử.,
100,Module 6. Ứng dụng trí tuệ nhân tạo,6,4,"Theo Chiến lược Chuyển đổi số quốc gia, mục tiêu đến năm 2030 là bao nhiêu phần trăm dân số có năng lực số cơ bản?",50%.,60%.,70%.,80%.,C,70%.,
101,Module 6. Ứng dụng trí tuệ nhân tạo,6,4,"Trong lĩnh vực giáo dục, một trong những mục tiêu chuyển đổi số là đào tạo lại, đào tạo nâng cao kỹ năng số cho đối tượng nào?",Quyền cho phép người khác sử dụng miễn phí tác phẩm.,Tất cả người dân qua các khóa học đại trà trực tuyến mở.,Phải chia sẻ tác phẩm gốc cho ít nhất hai người khác,Phổ biến các hình thức xử phạt khi vi phạm bản quyền.,B,Tất cả người dân qua các khóa học đại trà trực tuyến mở.,
102,Module 6. Ứng dụng trí tuệ nhân tạo,6,4,"Trong tài chính thông minh, ứng dụng AI có thể giúp phát hiện các mối đe dọa nào?",Hạn chế số lượng xe cá nhân được phép lưu thông.,"Quá trình ""sao chép"" nội dung từ nguồn khác.",Gian lận và hoạt động giao dịch bất hợp pháp.,Mã hóa dữ liệu và đòi tiền chuộc (ransomware).,C,Gian lận và hoạt động giao dịch bất hợp pháp.,
103,Module 6. Ứng dụng trí tuệ nhân tạo,6,4,"Mục tiêu của Chính phủ số là cung cấp dịch vụ chất lượng hơn, đưa ra quyết định kịp thời hơn, ban hành chính sách tốt hơn, dựa trên nền tảng nào?",Dữ liệu và công nghệ số.,Các quy trình truyền thống.,Các thỏa thuận quốc tế.,Các chuyên gia tài chính.,A,Dữ liệu và công nghệ số.,
104,Module 6. Ứng dụng trí tuệ nhân tạo,6,4,"Trong lĩnh vực giáo dục, mục tiêu thử nghiệm chương trình đào tạo cho phép học sinh, sinh viên học trực tuyến tối thiểu bao nhiêu phần trăm nội dung chương trình?",Sai sót trong mã lập trình hoặc cài đặt,20% (Theo Tài liệu - Cẩm nang BTTTT).,Thể hiện sự đồng ý với người đang nói,Giao diện chương trình có màu sắc mới,B,20% (Theo Tài liệu - Cẩm nang BTTTT).,
